{
  "$schema": "http://json-schema.org/draft-07/schema#",
  "$id": "music-prompt.schema.json",
  "title": "音楽プロンプト",
  "description": "music が生成する Suno / Lyria prompt の JSON 正本。HTML は prompt 承認 gate の表示に使う。",
  "type": "object",
  "required": ["schema_version", "generated_at", "engine", "collection_id", "provenance", "entries"],
  "properties": {
    "schema_version": {"title": "Schema version", "const": 1, "x-view": {"order": 0, "collapsed": true}},
    "generated_at": {"title": "生成日時", "type": "string", "pattern": "^[0-9]{4}-[0-9]{2}-[0-9]{2}T[0-9]{2}:[0-9]{2}:[0-9]{2}Z$", "x-view": {"order": 1, "collapsed": true}},
    "engine": {"title": "Music engine", "enum": ["suno", "lyria"], "x-view": {"order": 2, "collapsed": true}},
    "model": {"title": "Generation model", "type": "string", "minLength": 1, "x-view": {"order": 4, "collapsed": true}},
    "collection_id": {"title": "Collection", "type": "string", "minLength": 1, "x-view": {"order": 3, "collapsed": true}},
    "provenance": {"title": "Provenance", "$ref": "#/definitions/provenance", "x-view": {"order": 10, "collapsed": true}},
    "entries": {"title": "Album flow / prompt entries", "description": "アルバム順と各トラックの生成入力・品質根拠", "type": "array", "minItems": 1, "items": {"$ref": "#/definitions/entry"}, "x-view": {"order": 20, "presentation": "cards", "summary": true, "priority": "high"}},
    "duration_filter": {
      "title": "Suno duration guard",
      "type": "object",
      "required": ["min_sec", "max_sec"],
      "properties": {
        "min_sec": {"type": "number", "minimum": 0},
        "max_sec": {"type": "number", "minimum": 0}
      },
      "additionalProperties": false,
      "x-view": {"order": 21}
    }
  },
  "additionalProperties": true,
  "definitions": {
    "provenance": {
      "type": "object",
      "required": ["producer", "source_paths"],
      "properties": {
        "producer": {"title": "Producer", "const": "music", "x-view": {"order": 0}},
        "source_paths": {"title": "Source paths", "type": "array", "minItems": 1, "uniqueItems": true, "items": {"type": "string", "minLength": 1}, "x-view": {"order": 1}},
        "insight_ids": {"title": "Insight IDs", "type": "array", "uniqueItems": true, "items": {"type": "string", "minLength": 1}, "x-view": {"order": 2}}
      },
      "additionalProperties": true
    },
    "review": {
      "type": "object",
      "required": ["verify_status", "semantic_status", "notes"],
      "properties": {
        "verify_status": {"title": "Machine verification", "enum": ["pass", "fail"], "x-view": {"order": 0, "statusMap": {"pass": "pass", "fail": "fail"}, "statusSummary": true}},
        "semantic_status": {"title": "Semantic review", "enum": ["pass", "fail"], "x-view": {"order": 1, "statusMap": {"pass": "pass", "fail": "fail"}, "statusSummary": true}},
        "notes": {"title": "Review notes", "type": "array", "items": {"type": "string", "minLength": 1}, "x-view": {"order": 2}}
      },
      "additionalProperties": true
    },
    "entry": {
      "type": "object",
      "required": ["name", "style", "lyrics", "options", "track_role", "review"],
      "properties": {
        "name": {"title": "Entry name", "type": "string", "minLength": 1, "x-view": {"order": 0}},
        "title": {"title": "Song title", "type": "string", "minLength": 1, "x-view": {"order": 1}},
        "style": {"title": "Style / prompt", "type": "string", "minLength": 1, "x-view": {"order": 2, "copyable": true}},
        "lyrics": {"title": "Lyrics", "type": "string", "x-view": {"order": 3, "collapsed": true, "copyable": true}},
        "sections": {"title": "Sections", "type": "array", "items": {}, "x-view": {"order": 4}},
        "options": {"title": "Generation options / More Options", "type": "object", "additionalProperties": true, "x-view": {"order": 5, "collapsed": true}},
        "track_role": {"title": "Track role", "type": "string", "minLength": 1, "x-view": {"order": 6}},
        "quality": {"title": "Quality", "type": "object", "additionalProperties": true, "x-view": {"order": 7, "collapsed": true}},
        "review": {"title": "Review result", "$ref": "#/definitions/review", "x-view": {"order": 8}}
      },
      "additionalProperties": true
    }
  }
}
